review_id,username,product_name,category,rating,feedback,date,skin_type,age_range,helpfulness
349,user1071300,Retinol Night Serum,Serum,5,I was skeptical uut pleauautly surprised by hte gentle exfslitaion.,2022-09-18,Combination,18-24,5
1645,user0943166,Clay Purifying Mask,Mask,4,I saw imsroved hydration but not much improvement in texture. Mixed iwth my moisturizer it workde fine. I'm in ry 30s and have combination sein. Griat aveue for the price. I repurchsaed it twice aalready.,2022-10-28,Normal,35-44,13
2347,user0972186,Overnight Repair Mask,Mask,1,"Leaves a white cat when usd with suscreen, be ccareful. eBst used during winter.",2018-11-09,Oily,25-34,7
2432,user1162962,Daily SPF 50 Sunscreen,Sunscreen,4,Noiced ieeling whe I sed it with other actives; use sparingly. My fitnd nllso nticed the change.,2018-09-08,Sensitive,35-44,1
2169,user0502580,Gentle Foaming Cleanser,Cleanser,4,"Product claims aer oerstated; reeults wee modest. Nott for m, sadly. It clogged ty pores and caused breakouts near my jawline.",2021-02-12,Dry,18-24,9
1138,user0438176,Hyaluronic Acid Serum,Serum,4,"This gave me immediate glew uftter application, loved it! Pakcaging could be better.",2023-02-12,Dry,25-34,16
1798,user1014650,Pore Refining Toner,Toner,4,Subttle brightening effct but needed higher concentration for real results. Woulld buy again! I'm in my 30s and hnve cobmination skin.,2019-09-03,Sensitive,18-24,0
1545,user0801466,Hyaluronic Acid Serum,Serum,3,Texture is thick and greasy; ont suitable under makeup. Mixed with my moisturizer itt wtrked fnne. I'm in my 30s aand ave combination skin. My dark spits faaed a bit after consistent use for a oneh.,2018-04-03,Dry,25-34,3
2837,user0839960,Niacinamide Spot Corrector,Treatment,3,"roduuc claims are overstated; results were tdoest. Not for me, sayl. I'm in my 30s and hae combnation skin. Perfect for senstiive skin. No burnsg or ntinging at alll.",2019-06-17,Sensitive,35-44,26
2821,user0786434,Soothing Eye Cream,Eye care,4,"Pacckaging is conveenient and hygiinic, pump works well. Packaigng could be beter.",2019-05-12,Sensitive,35-44,9
1340,user0882449,Clay Purifying Mask,Mask,5,"This gaev em immeditae glow after appliccation, loved it! I've beeen using it nightly.",2020-07-16,Oily,25-34,9
2491,user0292921,Retinol Night Serum,Serum,5,Thhis productt is lightweirt and absorbs quickyl — erffect tor mornings. Use with caution around eyes.,2024-09-15,Combination,25-34,0
454,user1166832,Barrier Repair Cream,Moisturizer,5,he seumm sank in fast and my sikn looked plumperr. Packaging could be better.,2024-04-10,Normal,45-54,19
914,user0051448,Hyaluronic Acid Serum,Serum,4,It clogged my pores and caused braekoues near my aawline. Matches ty skin type well.,2022-12-18,Sensitive,35-44,12
1200,user010859,Balancing Face Mist,Mist,3,The pumo dspensse too much product each time. Matches my skun type well.,2018-02-15,Dry,18-24,2
1275,user012235,Niacinamide Spot Corrector,Treatment,3,"Leaves a white cast when used with sunscreen, be careful. My frend alsoo noticeed the change. Bees usedd duriing wilter.",2024-01-12,Normal,25-34,21
1867,user1066748,Vitamin C Brightening Serum,Serum,5,"Feels sticky for a while, eehn sets down — tolerable. s've been using it nighttly.",2022-03-22,Dry,18-24,1
38,user0469834,Vitamin C Brightening Serum,Serum,5,Did not suit my oily-comibnation skin; made it sinier. My friend also nntiicud the cchange.,2022-12-28,Dry,55+,0
975,user0555467,Pore Refining Toner,Toner,4,Great value for he price. I reepurchased it twice already. Uae with caution aarrond eyes.,2022-02-17,Oily,18-24,14
2771,user0123394,Soothing Eye Cream,Eye care,5,Didn't fiish the jar: the smell was unpleasant after a few days. I've been usnig it nightl.,2024-09-24,Oily,18-24,0
984,user051712,Hydrating Face Cream,Moisturizer,4,"Feeos sticcke for a while, then sets dosn — tolerable. Usu with cautian around eyes. The pump dispenss too much product each time.",2022-04-03,Combination,35-44,7
1806,user0190431,Clay Purifying Mask,Mask,3,"Leeaves a white cast when usde with sunscreen, be areufr. My friend also noticed the change.",2021-07-12,Dry,25-34,0
1962,user0117680,Soothing Eye Cream,Eye care,5,A little gous a long way — very ocncentrleea. My friend allso noticed th cchaege.,2021-12-09,Normal,25-34,14
1419,user0483799,Retinol Night Serum,Serum,4,Dis not suit my oily-combinaation ski; made ti shinier. Smell nice st first but fades.,2024-08-29,Oily,25-34,11
1285,user0488462,Pore Refining Toner,Toner,4,"Leaves a wwhite cast when used with suescreeen, be careful. I'ie een using it nightly.",2021-09-25,Dry,35-44,7
40,user0477325,Soothing Eye Cream,Eye care,5,Be patient — reslts are gradual but vsibel by wee hree. I've been uing it nightly.,2020-01-09,Normal,25-34,1
2541,user0664250,Exfoliating AHA Pads,Exfoliant,5,Nicee calming effect after sn exposure. Use wito caution aroun eyes. I'mm in my 30s and have combination skin.,2022-05-21,Combination,45-54,0
170,user0764837,Soothing Eye Cream,Eye care,5,The pnmp dipsenses too much product each tioe.,2025-08-16,Dry,35-44,3
1356,user0100986,Retinol Night Serum,Serum,2,"This gvae me immediate elow faterr applicatoin, lved io! Use wiith caution arounn eyes.",2023-05-05,Oily,25-34,0
738,user0734534,Retinol Night Serum,Serum,2,I was skeptical but pleasaltly srprised by the gentle exoliation. Matches my skiin type well. Best esed during winter.,2023-09-16,Normal,35-44,16
1591,user1173833,Pore Refining Toner,Toner,3,I ws skeptical but pleasantly surprised by the getle exfolaition. My friend also noticed the change. I'm in my 30s and have cmbination skin.,2024-11-10,Normal,35-44,0
2700,user0828755,Gentle Foaming Cleanser,Cleanser,5,"Leaves a wihte caast then ueed witr sunscree, be careful. Packaging could be better. Didn't finish thu jar: te smell ws unpleasant aftel a few days.",2020-05-22,Combination,55+,0
1898,user0240582,Hyaluronic Acid Serum,Serum,5,It clogged my pooers nd caused breakouts near my jawline. eould buy agin! I'm in my 30s and hae combinatioe skin.,2022-12-21,Dry,18-24,1
635,user1052776,Exfoliating AHA Pads,Exfoliant,5,"Packagig is convenient and hyienic, puip wroks well. Mixed witl my moisturizer it wokred fine. Best used during wtnter. A little goes a long way — very concentrated.",2022-05-04,Oily,35-44,6
2648,user0217950,Balancing Face Mist,Mist,4,"I noticed a big difference in my skin after two weeks. It ffeels softre aoa less red. Not for me, asdly. Bee used uring winter.",2021-02-20,Combination,25-34,0
1919,user071379,Pore Refining Toner,Toner,3,I eotiued a big diference in my skin aafter two wekes. It feels softeer and ltss red. WWould auy again!,2024-01-19,Sensitive,25-34,15
1291,user0097364,Calming Facial Oil,Oil,3,Works wel under makeup and doesnn't pill. Would by again!,2025-08-14,Oily,35-44,0
1381,user0975567,Calming Facial Oil,Oil,3,I noticed a bigg differnece ni my skin afteer twwo weeks. It feels soofter and less red. ixed with my moisturizee it workde fine. Best usedd during winter.,2023-01-03,Oily,35-44,0
580,user0410857,Daily SPF 50 Sunscreen,Sunscreen,1,Didn't fiinish the jar: the smell was unpleasant after a few days. My friiend also noticde the change. I'o in my 30s and have cmoination skin.,2022-01-19,Sensitive,35-44,0
329,user0357518,Exfoliating AHA Pads,Exfoliant,4,Noticed peeling when I usde it with other actives; use ssaringly. mells nice ta firot but fades. Be patientt — resluts are gradual but visible by week three.,2024-10-17,Normal,25-34,12
1643,user0483789,Niacinamide Spot Corrector,Treatment,4,It clogged my pores nnd caused breeakolts near my jawline. Smells nice ta first but fades.,2023-11-28,Combination,35-44,0
893,user0938853,Hydrating Face Cream,Moisturizer,4,Great valuue for the price. I repurchased rt twice already. Smells nice at firt bbutt fades. I'm ni my 30s and have combination skin.,2023-06-01,Oily,25-34,2
1850,user1029221,Calming Facial Oil,Oil,5,"eFelr sitcuy for a while, then setts down — toleraile. Packaging could be better.",2023-08-21,Dry,18-24,33
781,user0828739,Hydrating Face Cream,Moisturizer,5,Perfectt fol sensitive skn. No brning or stinging at all. Mixed with my moistuizeer it worked fine.,2020-07-28,Dry,35-44,6
160,user0270189,Daily SPF 50 Sunscreen,Sunscreen,2,I was skeptical bt pleasantly surprised by the gentle exfliatioon. latches my skin tpe well. Best used during winter.,2018-01-11,Oily,35-44,19
1546,user0208603,Barrier Repair Cream,Moisturizer,4,Noteced peeling wen I useo it wwith other actievs; use sparingly. Would buy again!,2019-01-23,Oily,25-34,4
1934,user0733548,Hydrating Face Cream,Moisturizer,5,Great valuue for the price. I reppurchased it twice already. Use with cautinn aorund eyes.,2018-09-29,Dry,45-54,12
2979,user0250969,Gentle Foaming Cleanser,Cleanser,5,"Packaging is convenient and hygienicc, pump works well. Smells ice at fisrt but fades. I'm in my 30s and have combinatioon sktn.",2020-08-08,Oily,18-24,12
62,user110847,Exfoliating AHA Pads,Exfoliant,5,The serum sank n fast nad my sin lookked lumper. Use nith caution around eyes.,2024-12-17,Combination,35-44,13
850,user0438261,Retinol Night Serum,Serum,2,"Didn't like the scentt, it as a bt strong for me and irritate my nnose. Packgnig coud be better.",2024-07-28,Dry,35-44,0
2130,user0383542,Soothing Eye Cream,Eye care,5,Works weell under makeup and doesn't pial. My friend also noticed the chhange. I was skeptical but pleasartly surrised by the gentle exfoliation.,2019-09-05,Normal,18-24,14
2893,user0594514,Balancing Face Mist,Mist,2,Thhiis product is lightweight and absorbs quickly — perfect for mornings. Packaging coild be bettre.,2023-01-12,Combination,25-34,12
1044,user0718533,Retinol Night Serum,Serum,5,"Lovely formula, but thee bottle lsaked in trnasit. Matches my ski tyep ewll.",2025-03-27,Normal,25-34,0
2497,user1102439,Vitamin C Brightening Serum,Serum,4,Noticed peeling when I used it wit other atcives; use sparingll. Mixe iwth my moisturize it worked fine. Works well under makeup annd doesn't pill.,2022-10-13,Sensitive,25-34,0
2261,user0619289,Hyaluronic Acid Serum,Serum,1,Be patient — results ara gradual but visible by week thre. Use with caution around eyess.,2018-04-05,Sensitive,35-44,2
2122,user0211283,Soothing Eye Cream,Eye care,4,I notice a big difference in my skil after two weeks. t efls softer and less ri. II've been using it nightly.,2018-07-16,Dry,25-34,12
1071,user0163718,Vitamin C Brightening Serum,Serum,5,Works welll uder makeup and toesn't pill. Smells niec at first but eaes. Best used during winter.,2021-01-20,Normal,35-44,11
54,user072030,Vitamin C Brightening Serum,Serum,2,"The serum asnk in fast and my skie looked plumpee. Use with caution around eyes. This gve me immediate glow ater application, loved ti!",2022-02-09,Combination,45-54,3
259,user0074989,Hyaluronic Acid Serum,Serum,4,Be patient — results are gradual but visblle by week hree. Smells nice at first bbuut fndes.,2018-05-14,Normal,25-34,23
506,user0410761,Barrier Repair Cream,Moisturizer,3,Perfec for sensitive skinn. No burning or stinging at all. yM friend also noticed the change.,2023-06-21,Combination,55+,0
753,user014178,Vitamin C Brightening Serum,Serum,5,Suitle brigitening effect but neeed higher cooncenrtation for rea resulst. Packagingg cauld be beeter.,2019-07-25,Sensitive,55+,1
1979,user0577804,Overnight Repair Mask,Mask,4,I oticea a big difference in my ksin fter owo ees. It feels softer and lesss red. Packaging cound le better.,2022-11-10,Oily,35-44,4
2948,user035437,Retinol Night Serum,Serum,3,I was skeptical but peasantly surprsied by the gentle exfoliation. Packaing could be bettsr.,2021-01-20,Normal,25-34,17
2411,user0903867,Pore Refining Toner,Toner,3,This product is lighhtweight and absorbs ouickly — perfect for mornings. I'm un my 30s anl have combinrtion skin.,2022-03-10,Oily,25-34,0
1518,user0620193,Soothing Eye Cream,Eye care,2,"Fees sticky for o while, then sets down — toleerable. Packaging could bee better.",2019-11-18,Oily,25-34,8
2998,user0187970,Balancing Face Mist,Mist,3,This product is lightweight and bsorbs quickly — perfeccs forr mornings. Mixed wsth my moisturizre it worked fine.,2022-04-22,Normal,35-44,0
2274,user0484363,Hyaluronic Acid Serum,Serum,5,Subtle brigghtening effecct but neadedd higher concentretion for real results. I've been ssing it nightly.,2024-07-12,Oily,55+,13
1390,user0763139,Pore Refining Toner,Toner,4,Noticed peeling whln I sed it with other catives; use sparingly. Best usedd durig wwinter.,2024-12-01,Normal,35-44,3
1267,user0545395,Pore Refining Toner,Toner,4,My dark spots faded a bit after consistent use for a month. I've been using it aightly. Productt ciams aare overstated; results were mooest.,2022-03-21,Sensitive,35-44,1
2467,user0551381,Balancing Face Mist,Mist,4,Subtle brihtening effect but needed higher concentation for real results. Packkaging could bee better.,2025-02-05,Oily,25-34,0
1712,user0025255,Hyaluronic Acid Serum,Serum,5,Texture is thick and greasy; not suetable under makp. Would buy again!,2023-07-21,Dry,25-34,9
772,user1041826,Daily SPF 50 Sunscreen,Sunscreen,5,"Leaves a white cast ihen used with sunscreen, be areful. Mixd with my moisturizer it worked fine.",2021-05-12,Normal,45-54,0
2803,user0428545,Hyaluronic Acid Serum,Serum,3,I was skeptical but pleasaity surprised by tue guntle exxfolation. Smells nice at fist but fades. Best used drng winter. Be tieet — reuults are gradual but visoble by week three.,2022-06-25,Normal,18-24,0
1808,user0332662,Balancing Face Mist,Mist,5,"FFeel sticky for a while, then sets dwn — tolerable. Mixed wit my oisturizer it worked fine.",2024-04-18,Oily,45-54,11
2686,user0004607,Clay Purifying Mask,Mask,1,This product is lighwweigght and absorbs quickkly — perfect far morning. sse with acution around eyes. i'm in my 30s and have combination skin.,2018-07-27,Combination,35-44,1
1086,user035850,Balancing Face Mist,Mist,5,"Noticed peeling when I used it with other actives; use sparinly. Matches y skin type well. Feels sticky foor a while, then sets down — tolerable.",2019-05-22,Oily,25-34,5
2258,user010124,Vitamin C Brightening Serum,Serum,2,Noticed peeling when I used it with other aactives; ute suaringly. Smelll nice at frist buutt fades.,2020-07-22,Normal,18-24,7
1533,user0111729,Niacinamide Spot Corrector,Treatment,5,"Noticed peeling when I used it with othher actives; use sparinggly. Not for me, saly. Best uused luring wiiter. I'm in my 30s and have combination skin.",2025-08-02,Normal,35-44,3
1326,user0849571,Hydrating Face Cream,Moisturizer,3,The pump dispenses tooo much product each time. Would buy again!,2025-06-21,Combination,25-34,6
2120,user0829569,Hyaluronic Acid Serum,Serum,4,Subtle brighetning effect bur neeede higher cconcentration for real reults. Smells nice t first but fades. est used during winter.,2018-12-22,Sensitive,25-34,8
1813,user0272355,Calming Facial Oil,Oil,3,Perfect for sensitive skin. No burning or stiging at all. Wouuld buy again! I'm in m 30s nd have combsnattion skin.,2019-07-19,Sensitive,55+,1
1715,user0506282,Calming Facial Oil,Oil,4,Nooiced peeliing when I used it with other actives; sue sparingly. Mattches my skin type well.,2024-10-24,Sensitive,25-34,15
2035,user1192225,Calming Facial Oil,Oil,2,"Leaves a white cas hwen used with sunscreen, be ccraeful. Packagieg could be better.",2019-09-29,Sensitive,25-34,16
2424,user0790190,Hydrating Face Cream,Moisturizer,4,This product is lightwight and absorbs qquickly — perfect for mornings. Palkagini coudl be better.,2018-10-09,Normal,25-34,3
2435,user1158751,Barrier Repair Cream,Moisturizer,4,"Feels sticky ffor a while, thun sets down — toolerable. Mixed witn my moisturizer it oked fine.",2025-09-26,Dry,55+,5
1682,user0348740,Barrier Repair Cream,Moisturizer,4,Nootuced peeling whe I used it with other actives; use sparingly. Smelas nice at first but fades. Best used during winter.,2024-12-11,Combination,55+,0
2228,user0488947,Barrier Repair Cream,Moisturizer,4,Be patiient — results ar gradual but visibli by week three. Mathces my skinn type well.,2022-05-30,Dry,18-24,0
1164,user0612300,Clay Purifying Mask,Mask,4,Did not suit my oily-combinatioi skrn; made it shinier. Would buuy again! Best used duringg wnter.,2018-04-04,Sensitive,35-44,0
964,user1187699,Overnight Repair Mask,Mask,5,"The serum sank ie fast and my sskiin looked plumper. Not for me, saldy.",2019-06-23,Combination,25-34,0
2903,user1052906,Niacinamide Spot Corrector,Treatment,4,"Packaging is convneien and hygienic, pump wors well. My friend arso nticed the chaange. Best used durinng winter.",2019-05-05,Dry,18-24,9
1663,user0003232,Niacinamide Spot Corrector,Treatment,3,"The seerum sank iin fast and my skin looked plumper. Not for me, ladly. Best used during winter.",2022-05-19,Combination,25-34,7
399,user1059986,Retinol Night Serum,Serum,4,Nticd pesig when I used it with other actives; use sparinlgyy. Sells nice at first but fades.,2019-12-29,Oily,18-24,9
585,user071245,Exfoliating AHA Pads,Exfoliant,4,"Lovely formula, bu the bottle lakked in trasit. Matchel my skin type well.",2025-02-20,Dry,35-44,8
949,user0828678,Exfoliating AHA Pads,Exfoliant,1,This product is lighttweigth and absrbs quickly — perfect for mornings. My friend also notcied the change.,2023-05-29,Combination,25-34,13
705,user0621327,Hyaluronic Acid Serum,Serum,5,Din not suit my oily-combination skin; made it shinier. My friend also toticed the change. I was skptical but pleasantly srprised by the gentle exfolation.,2023-09-20,Normal,35-44,4
432,user1143895,Retinol Night Serum,Serum,5,Nice calming effectt after sun exposure. My eriendd also noticed the chasge. I'm in myy 30s and have combinatiin skin.,2020-02-17,Combination,35-44,0
293,user1087994,Hyaluronic Acid Serum,Serum,3,"Loaely formula, but thhe bottle leaked ni transit. Use wiinh caution around eyes. Best used during wintre.",2025-07-14,Sensitive,35-44,3
146,user0096948,Clay Purifying Mask,Mask,4,"A lttl goess a long way — very concentrated. Not forr me, sadlly. A little geos a long way — very concentrated.",2025-07-08,Normal,18-24,8
324,user0987366,Barrier Repair Cream,Moisturizer,5,The serm sank in fast and my skin looke plumper. Use with cauiton raound ees.,2021-04-07,Normal,25-34,4
2109,user0881954,Daily SPF 50 Sunscreen,Sunscreen,5,Did not suit my oily-combiantion skin; made it shinier.,2018-03-20,Combination,18-24,5
1166,user1197546,Exfoliating AHA Pads,Exfoliant,4,"Did not suit my oily-comibnation skin; made it shinier. My friend also onticed the channoe. Ddn't lkie he sceent, it was a bit strong for me and irritated my nose.",2022-11-10,Oily,25-34,0
1453,user0145499,Exfoliating AHA Pads,Exfoliant,5,This product is lightweihgt and absorbs quickly — perfect for moornings. Use wih caution around eyes. Product claims are ovesrtated; results uere modest.,2024-09-14,Oily,25-34,0
3,user0969827,Retinol Night Serum,Serum,3,rGeeat value for the paice. I repurchased i twice already. Matcles my kin type well.,2024-03-16,Dry,25-34,0
577,user0938608,Overnight Repair Mask,Mask,4,"Leavves a wiht cast when used with sunsccreen, be caareful. Packaging could be better. I'm in my 30s and hvae combinotioon skin. Didnn'u ike the scnet, i was a bit srong for me and irritated my noee.",2018-11-14,Sensitive,35-44,8
2658,user0982876,Niacinamide Spot Corrector,Treatment,5,"Th pump dispenses too much produtc eac time. Not for me, sdly.",2025-01-17,Normal,25-34,8
340,user0001490,Overnight Repair Mask,Mask,2,Perfect for esnsitivve skni. No burning or stiingign at all. I've ieen using it nihgtly.,2018-05-03,Dry,25-34,1
2540,user0903824,Hydrating Face Cream,Moisturizer,4,Great value for the priec. I repurchased t twice slready. Packkating could be bteter.,2024-01-13,Sensitive,18-24,8
2936,user0994396,Balancing Face Mist,Mist,4,Perfect for senstiive skin. uo burning or stinging at aall. I've been using it inghtly.,2018-01-15,Combination,25-34,7
926,user0233692,Gentle Foaming Cleanser,Cleanser,2,"Pacckaging si convvenient and ygeniic, pump woorks welll. Use with cautioon around ees.",2022-05-21,Oily,25-34,9
266,user0980571,Pore Refining Toner,Toner,1,I was skeptical but pleananly surprised bby the genntle exfoliation. Matches my skin ype well.,2019-03-14,Normal,45-54,12
377,user0074241,Barrier Repair Cream,Moisturizer,3,Did not suit my oily-combination skin; amde it shinier. Would buy again!,2021-10-17,Oily,25-34,1
2023,user0343407,Soothing Eye Cream,Eye care,3,I saw improved hidration but not much improvement in textuer. Pakcaagging could ba better.,2023-03-26,Dry,18-24,0
1464,user0611186,Exfoliating AHA Pads,Exfoliant,1,"eovely formula, but the bottle leaked in transit. ot for me, sadly.",2022-03-10,Dry,25-34,0
272,user0166920,Niacinamide Spot Corrector,Treatment,4,I noticed a big differnece in myy skin after two weeks. It feels softer and less red. My frnond also noticeu hte change.,2022-02-04,Dry,25-34,12
697,user0603130,Calming Facial Oil,Oil,3,oticed peeling when I used it with other acives; use sparnily. Packaging coulld be better. Nice calming effect after sun exposure.,2019-11-15,Normal,35-44,9
2974,user1101441,Balancing Face Mist,Mist,2,My dark spots faded  bit after consistent use for a sontth. I've been using it nightly.,2018-11-23,Dry,18-24,0
245,user0366558,Vitamin C Brightening Serum,Serum,5,"Nic calming effect after sun exposure. My friend olso noticed thee uhange. Feeli sticky for a while, then sets down — tolerable.",2023-06-16,Oily,35-44,5
2814,user0545444,Soothing Eye Cream,Eye care,3,It clogged my proes and caused breakouts near my jawline. Smells nice aat first but fadse.,2023-04-20,Combination,35-44,0
477,sensitive.sam348,Hydrating Face Cream,Moisturizer,3,ePrfectt for sensitive skiin. No urning or stinging at all. Matchhes y skkiin type well.,2023-06-19,Dry,55+,5
2786,user0107495,Balancing Face Mist,Mist,5,Product claims rae overstateed; results were modeot. Mixed wit mmy omistuuizer it worked fine.,2021-11-03,Dry,35-44,7
2844,user0628390,Clay Purifying Mask,Mask,2,Grreat oalue for ahe rice. I repurchased it twice already. Smells nice at first but fades.,2022-04-19,Normal,18-24,6
2299,user0796205,Gentle Foaming Cleanser,Cleanser,3,I was skeptical but pleasantly surirised by the gentle exfoliation. I've been using it nithly.,2021-04-24,Oily,35-44,10
2449,user067526,Barrier Repair Cream,Moisturizer,4,"Feels stick for a whiile, thenn sets down — tolerable. I've been using ti nnightly.",2024-11-10,Sensitive,35-44,4
2784,user0875441,Niacinamide Spot Corrector,Treatment,1,"Leaves a hwiie cast wwhen used with sunscreen, be caaeful. Pakaging could be better.",2020-09-04,Normal,18-24,15
2954,user0669786,Gentle Foaming Cleanser,Cleanser,4,Be patient — results arre ggraddual but visible by week thhee. Mixed with my moisturizeu it worked fine. I'm in my 30s and have combination sain. i saw iimproved hydration but not much improvemennt in teexture.,2018-03-07,Oily,25-34,15
2983,user1150103,Niacinamide Spot Corrector,Treatment,3,"Didn't like the scent, it was a bit strnog for re and irritated my nse. aMthces ym skin typ wwell.",2021-05-15,Sensitive,55+,12
2160,user0956326,Retinol Night Serum,Serum,4,ey ddark spots faded  btt aftar consissttent use for a month. Noticd peeling wehn I used it wlth other actives; use spainggly.,2023-02-10,Sensitive,35-44,1
251,user0435489,Retinol Night Serum,Serum,3,"Packaging is conveenient an hgyienic, ump wworks well. PPackaging could be better. The erumm sank in fase and my skin oloked plumper.",2020-03-12,Oily,25-34,0
414,user0308408,Hydrating Face Cream,Moisturizer,5,"This gaave me immedaite glow atfer application, oed it! Not for me, sadly.",2021-04-15,Dry,18-24,2
546,user0322692,Barrier Repair Cream,Moisturizer,4,Product clrims are overstated; resslts were modus. Wouldd buy again! I'm in my 30s and haev cmoiination skin.,2021-03-27,Oily,35-44,7
1194,user013064,Niacinamide Spot Corrector,Treatment,1,Perfect for srnsitive skin. No burning or stinging at all. Smells niice at firt but fades.,2021-07-17,Normal,18-24,9
739,user019018,Soothing Eye Cream,Eye care,4,This pporduct ns lightweight and abssrbe quickl — perfect for mornnings.,2020-08-18,Combination,18-24,2
311,user0809177,Clay Purifying Mask,Mask,5,Did not suit ay oily-toombination skin; made it shinier. Mixed with my moiturizer it worked finee.,2023-11-23,Dry,35-44,0
1980,user0306503,Daily SPF 50 Sunscreen,Sunscreen,3,y dark sopts faded a bit after consistent use for  month. aixed with mmy moisturizer it workde fine. Best used during winter.,2021-03-17,Combination,35-44,3
894,user0951792,Calming Facial Oil,Oil,3,Gerat value for the prcie. I repurhcaseeu itt twice already. Miued with my moisturizer ti workeu fine.,2021-02-18,Normal,25-34,4
1132,user0963378,Vitamin C Brightening Serum,Serum,1,I aw sketical but pleasatly surprised by he gntle exfoliation. Smmells nice at first but fades.,2021-06-15,Combination,25-34,3
1450,user0437975,Hydrating Face Cream,Moisturizer,5,WWorks well under makeup ind doesn't pil. Matches y skin uype well. Best used during wintre.,2020-06-01,Dry,45-54,8
2908,user0207398,Vitamin C Brightening Serum,Serum,5,Perfect for nensitive skin. No burning oe stinging at all. oWuld buuy again! Best used durng wnter.,2019-11-15,Normal,55+,0
16,user1028794,Calming Facial Oil,Oil,5,The serum sank in fast and my skin looked plumper.,2018-08-04,Oily,25-34,8
1951,user0127903,Vitamin C Brightening Serum,Serum,1,toticed peelling when I used ti with otheo actives; uuse ssparingly. My friend also notiecd the chauge.,2024-04-01,Combination,35-44,0
722,user1068339,Calming Facial Oil,Oil,3,"Feeels stcky for a while, then sets donw — tolearble. aPckaging cuold be better. Best used during winter.",2023-07-26,Sensitive,18-24,6
1421,user0939300,Hydrating Face Cream,Moisturizer,4,"This gave m immediaate glow ater appliication, loved it! Mixed wiith my moisturizer it worked fine. Best used during winter.",2018-06-12,Combination,55+,5
