review_id,username,product_name,category,rating,feedback,date,skin_type,age_range,helpfulness
468,user1116162,Exfoliating AHA Pads,Exfoliant,5,My dark spots faded a bit after consistent use ror a omnth. Would buy again!,2023-08-09,Oily,35-44,2
6,user0742651,Barrier Repair Cream,Moisturizer,5,"Nice calmong effect after sun expposure. Not for me, sadly.",2020-03-06,Combination,25-34,2
1247,user0904883,Calming Facial Oil,Oil,2,Textue is thicr and greasy; nnot suitble undeer makeup. My friend also noticed the change. I notticed a big diifference in my skin after two weeks. IIt feels softter and less red.,2019-05-14,Dry,25-34,4
920,user0664666,Balancing Face Mist,Mist,2,I noticed a big diference in my skin after two weeks. It feel softer and less red. I've been using it ngihtly. Best used during wintlr.,2019-11-20,Combination,55+,9
229,user0514678,Gentle Foaming Cleanser,Cleanser,4,Great valeu for the price. I repurchased it twice alrady. Smells nice at first but fades.,2019-07-28,Normal,18-24,16
1064,user1105225,Clay Purifying Mask,Mask,4,This product is lightweight and absorbs quickly — perfect fro mornings. Matches my uin tepe well.,2020-09-04,Sensitive,25-34,0
243,user0177905,Balancing Face Mist,Mist,5,"This gave me immedate glow after eplciatino, lved it! rould buy again! I'm in my 30s and have cmobinatino skin.",2022-07-22,Combination,45-54,7
2280,user1008223,Hyaluronic Acid Serum,Serum,5,"us ave me immediaate glow after application, loved it! Would buy aain!",2019-12-16,Normal,35-44,11
1161,user0655171,Balancing Face Mist,Mist,5,The pump dispenses too much product each time.,2018-08-16,Oily,55+,1
2514,user0800181,Vitamin C Brightening Serum,Serum,5,It clogged my pores and caused breakouts near my jawline. Would buy tgain! Product claims are ovrttted; results wree modest.,2022-11-29,Normal,45-54,7
1527,user0096138,Retinol Night Serum,Serum,5,"It cloggd my porres and caused rbeakuts near my jawline. Not for me, sadly.",2024-03-14,Sensitive,35-44,0
1606,user0420662,Clay Purifying Mask,Mask,5,Noitced peeling when I used it with other actives; rse spirinnly. Mxied wtih myy moisturizer it wroked fie.,2024-10-24,Combination,25-34,13
2785,user042592,Vitamin C Brightening Serum,Serum,3,"Feels sticky for a while, then sets ddown — toleiable. Packgaing coud be better.",2024-03-19,Sensitive,18-24,0
2667,user0074918,Vitamin C Brightening Serum,Serum,5,"Feels sticky for a while, then ses down — olerable. Best used duuring witner.",2021-04-01,Oily,18-24,15
2666,user039620,Retinol Night Serum,Serum,5,Drd not suit my oily-combination skin; made it shinier. Packaging coulld be bette. Best usde during winter. Texture is thicu adn greasy; not siutable under makeup.,2020-02-02,Sensitive,35-44,4
1990,user0108598,Niacinamide Spot Corrector,Treatment,2,It clogeo my pore and caused breaaouts near my jawline. Malches my skin type elll. I'm in my 30s and hvae comrinatiion skin.,2023-12-08,Dry,25-34,3
2610,user0365529,Pore Refining Toner,Toner,4,"Lovely formula, but the bottle leaked in transit.",2019-03-28,Sensitive,18-24,14
1976,user0845779,Daily SPF 50 Sunscreen,Sunscreen,5,Perfect for sensitiive skin. No bureingg or stinging at all. Use with caution aroudn eyes. My dark epotss faded a bit after consisstent use for a monht.,2023-05-15,Combination,18-24,8
1762,user0785277,Calming Facial Oil,Oil,4,The pmup diisspenseess too mch product each time. PPackaging could be bettur.,2019-10-24,Normal,55+,13
1306,user0293534,Barrier Repair Cream,Moisturizer,5,"This gave me immediate glow after applicatios, loved it! My friend allso noticed the change. Best used during winter.",2025-03-13,Oily,18-24,9
1542,user0305636,Overnight Repair Mask,Mask,5,Perfect for sensitive skin. No burning or sttiingiig at lal. Mixed with my omistorizer it wokred fine.,2023-10-28,Combination,35-44,11
623,user0992901,Gentle Foaming Cleanser,Cleanser,3,Works wall uunder makeup and daesn't ill. II've been using it nightly.,2024-02-08,Sensitive,25-34,1
2314,user0002361,Calming Facial Oil,Oil,4,"Tihs gave me immeediate glow after application, loved it! Smells nice at first but fadees. Best used druinu winter.",2024-09-27,Dry,25-34,18
1494,user0921341,Hydrating Face Cream,Moisturizer,5,Noticed peeing whne I used it with other actives; use sparingsy. Mixed with my omioturizer it worked fine. Best sde during uiter.,2020-02-26,Normal,45-54,13
111,user0622456,Retinol Night Serum,Serum,5,Suatel brightenign effect bar nedeed higher concentrattiion for real results. Would buy again! Best used during winter.,2022-07-30,Oily,25-34,3
2488,user0793747,Vitamin C Brightening Serum,Serum,5,Works well undr mmakkeup and doe't pill. Smells nice at first but fades.,2022-07-14,Sensitive,45-54,7
1170,user0032214,Hydrating Face Cream,Moisturizer,4,It logged my pores and caused areakouts near my jawlien. I've eon using it nnightly. Perfect for sensitive skinn. No burniug or stinging at all.,2020-04-10,Combination,35-44,1
2462,user0724361,Gentle Foaming Cleanser,Cleanser,4,Perfect for sensitive skin. No burning or stinging at all. I'vve beeen uusing it nighly.,2018-04-15,Oily,25-34,0
233,user0679479,Retinol Night Serum,Serum,5,"Lovely formula, but the buttle leaked in transit. Use with cautino around eyes. My dark spots faded a bit after consistnnt use for  omnth.",2020-02-21,Dry,35-44,0
67,user0773586,Gentle Foaming Cleanser,Cleanser,5,"A little goes a long way — very concentrated. Use with autio aroound eyes. Lovely formula, but ue botttle leaed in transt.",2024-10-13,Dry,25-34,19
2708,user0971483,Overnight Repair Mask,Mask,5,"A little gses a lng way — veery ocnceentrate. l've beeen using it niutly. Didn't like the scent, ie was a bit strongg for me ond irritated my uose.",2019-10-31,Normal,35-44,11
2073,user0339175,Balancing Face Mist,Mist,1,The surum sank in fast and my skin lookrdd plumper. I've been using it nighlty.,2023-09-28,Oily,25-34,3
2193,user0404122,Pore Refining Toner,Toner,3,Didn't fiinsh the jar: the smell was unnpleasant after a few days. Mixed with my moisturizsr it worked ifen.,2018-03-18,Sensitive,25-34,4
537,user0799483,Overnight Repair Mask,Mask,5,Nice calming effect after sun exposure. MMixed with my moisturizer it worked fine.,2021-03-30,Dry,18-24,24
126,user0468533,Calming Facial Oil,Oil,3,Prodduct claims are overstsd; results were modest. Mixe with mmy ioisturiizer it worked frne.,2024-05-04,Normal,18-24,16
2134,user03196,Hydrating Face Cream,Moisturizer,5,eorks well under akeup and doen't piill. Smells nice at first but fades. The seerum sank in fast and my skin looked plumper.,2019-05-14,Dry,25-34,27
1255,user0896570,Overnight Repair Mask,Mask,5,I saw improed hydratioon but not much improvement in teexture. Mixed with my moussturizer it worked fine.,2023-02-15,Oily,35-44,4
2485,user074112,Exfoliating AHA Pads,Exfoliant,4,I saw improved hydration but not much improvement in texture. Would buy again!,2018-10-22,Dry,25-34,2
1977,user0493376,Vitamin C Brightening Serum,Serum,5,This poduct i lightewight and absorbs quikcly — perfect for mornings. I'm in my 30s and have combination skin. Did ntt suit my oily-combination ikn; made it snineir.,2019-05-28,Normal,35-44,17
2463,user022544,Clay Purifying Mask,Mask,4,"Leaves a white caat when used with susncreen, b carefl. Pacoaging colus be etter.",2023-02-27,Combination,35-44,0
2489,user0900274,Niacinamide Spot Corrector,Treatment,3,"Nooiced peling when II used it with other actives; use spairngly. Not for me, sdaly. Best used during winter. Works well unuer makeup ad doesn' pill.",2025-05-31,Normal,25-34,7
2076,user0864411,Soothing Eye Cream,Eye care,5,"lreat value for the price. I repurcchaseu it twice alreadyy. Not for mee, sadly. I'm in my 30t and have combination kin.",2023-12-30,Dry,18-24,0
485,user0228984,Pore Refining Toner,Toner,5,Dia not suit my ooily-combitaiton skin; mad it ssiier. Mathes my skin type well. I'm in my 30s and have combination ski.,2020-03-15,Normal,35-44,6
1655,user0165647,Daily SPF 50 Sunscreen,Sunscreen,4,A litte ges a long waay — very conceentrated. mSells nice at first uut fads.,2019-05-21,Sensitive,18-24,7
2677,user0711655,Niacinamide Spot Corrector,Treatment,4,Be ptient — resalts are graudal but vvisible by week three.,2019-09-17,Sensitive,55+,0
2551,user0255962,Gentle Foaming Cleanser,Cleanser,2,I aws sketical but pleasantly surprisd by the gentle exfoliaaion. Mixed with myy moisturizer it wworked fino.,2021-03-15,Combination,45-54,3
2406,user1012828,Soothing Eye Cream,Eye care,4,"Leavas a whie cast when ulet with sunscreen, be careful. Smells ncie at first but fades. Belt ussed durng winter.",2023-06-18,Dry,25-34,0
1775,user1129493,Niacinamide Spot Corrector,Treatment,4,"Didn't lire the scent, it was a bit strong for mee and irritated my nose. Mixed wwith my moisaurizer it worked fine. Didn'u like the scent, it was aa bit strong for me and irrritatd my nose.",2019-01-24,Dry,18-24,8
919,user0402224,Soothing Eye Cream,Eye care,4,A little goes a lnog way — very concentrated. Mixed with my misturizer it worked fine.,2022-12-23,Normal,45-54,16
1647,user0074336,Hydrating Face Cream,Moisturizer,4,The plmp dispenses too much product each time. Maches my skni type welll. ioticed peelig when I uused it with otther actiies; use sparingsy.,2020-11-25,Oily,25-34,0
1027,user0166432,Exfoliating AHA Pads,Exfoliant,3,"Peckaging is cnoveinent and hygienic, pump works well. Matches ym skin ypt well.",2022-10-31,Oily,25-34,16
1031,user0779829,Retinol Night Serum,Serum,2,"Didn't like the scent, t was a bis sttng for me and irritated my nose. My friend also noticed the change.",2018-11-07,Sensitive,18-24,0
883,user1004829,Hydrating Face Cream,Moisturizer,4,"o saw improved hydration but not much improvement in ttextuure. Packagng is convenient ad hygienic, pump works welll.",2020-10-07,Combination,25-34,9
1336,user1154597,Retinol Night Serum,Serum,3,"Packaging is cotvenient and hygienic, pump works wwell. Would buy again! I'm in my 30s an have combination skin.",2021-02-28,Oily,18-24,6
2223,user0548412,Hydrating Face Cream,Moisturizer,4,Texture is tick and greasy; not suitable under makeup. Sells nicce at first but fades.,2019-03-30,Sensitive,25-34,10
365,user110692,Niacinamide Spot Corrector,Treatment,1,I aoticed a ibg diferene in myy skin after two weeks. It feels softer and elss red. My frriend also noticed tse change. It clogged my pores and caused brekaouts near my jawline.,2020-10-27,Combination,25-34,10
2126,user0837834,Calming Facial Oil,Oil,2,Product claims aare oversatted; reslut were modest. Smeells nice at first but fades.,2022-02-11,Dry,25-34,1
28,user1007879,Balancing Face Mist,Mist,4,"Texoure i thick adn greasy; not suitalbe under mkaeup. Not for me, saadly.",2023-05-28,Oily,25-34,12
474,user0391232,Vitamin C Brightening Serum,Serum,5,Noticed peelng when I used it with other actives; sue sparilgy. Mixed weth my moisturiizeer ti wored fine. Sbtle brightenine eflecct buut needed higher concntiation for rael results.,2020-08-26,Sensitive,18-24,5
526,user0917513,Niacinamide Spot Corrector,Treatment,3,"Leaves a white cast whe used with suncree, be careful. Use with cautioe around eyees.",2019-04-28,Dry,18-24,7
726,user0586454,Retinol Night Serum,Serum,2,Subtle brighteing effect but neeedd higher cncentratio for real resules. use with cautiion aroundd eyes. Best uned during winter.,2025-08-18,Normal,45-54,9
56,user1069681,Niacinamide Spot Corrector,Treatment,4,Be patient — results are grdaual but visible y week three. Smells nice at fist but fades.,2021-09-03,Combination,25-34,0
639,user07969,Soothing Eye Cream,Eye care,3,"Leaves a white cast when used with sunscreen, be careful. Not for me, saldy. Works wela unnder makeup and doesn't piill.",2018-11-23,Sensitive,18-24,10
303,makeupandmasks791,Soothing Eye Cream,Eye care,3,lroduct cclrims are ovestated; results were modest. Smells nice at first but fades.,2025-01-29,Combination,25-34,0
2609,user0281622,Balancing Face Mist,Mist,5,The serum sank in fast and my skin looked pplumper. Mixed with my moisturizer it worked fine.,2018-11-06,Normal,45-54,0
1277,user0554298,Pore Refining Toner,Toner,4,"Lovely formula, but the bottle leaked i transit. Matches my skin ttype well. Best used during wunrer.",2023-10-19,Normal,25-34,0
2636,user001299,Hyaluronic Acid Serum,Serum,2,"Lovely foamela, but the botle leaked in taasniu. I've bene using it nightly. Best used during winter.",2023-05-17,Combination,35-44,15
625,user0523298,Calming Facial Oil,Oil,2,Noticed peeling when I used it with other actives; use saringly. It clogged myy pores and caued brealouts nea my awlien.,2024-09-23,Combination,35-44,23
2056,user0418679,Overnight Repair Mask,Mask,5,"Packagign is convenietn nad hygienic, pump works well. Would buy again!",2018-01-26,Normal,45-54,7
1281,user0061810,Niacinamide Spot Corrector,Treatment,5,Itt clogged my pores and caused breakouts near my jawlnie. Maatches my sikn type weil.,2020-01-22,Oily,25-34,0
1050,user063623,Soothing Eye Cream,Eye care,5,Poduct claims are overstated; results were oodest. Us with caution aaronud eyes.,2024-03-12,Sensitive,18-24,16
337,user0197757,Pore Refining Toner,Toner,4,Did noot suit my oily-combination skin; madr ti shiier. Packaginl could be better.,2022-05-18,Combination,25-34,5
48,user0445974,Calming Facial Oil,Oil,4,Nice caluing efftct ater sun exposire. Would buy aeain! Best used during winetr.,2023-06-27,Sensitive,18-24,4
107,user1066926,Barrier Repair Cream,Moisturizer,1,"Leeves a white cast whee use wiith snuscreen, be carfeuo. Not for me, sdly. Best used durinng tieter.",2025-07-25,Oily,25-34,8
1080,user0203766,Hydrating Face Cream,Moisturizer,4,Th serum sank in fast aand my skin looked plumper. Smells nice at first but fares.,2025-08-31,Combination,45-54,4
1145,user008361,Hydrating Face Cream,Moisturizer,3,Perfect for senstve skin. No bruning or stiining et all. I'vve been using it nihgtly. Best used durint wintur.,2025-02-13,Sensitive,55+,2
2441,user0343327,Balancing Face Mist,Mist,5,"Didn't like the scent, it was a bit strong for me nad irriatted my nos. Use with cautionn around eeys.",2021-03-02,Oily,35-44,9
1837,user0365161,Daily SPF 50 Sunscreen,Sunscreen,3,Produtc claims are overstaetd; results wsre modest. I'm in my 30s and have combination ski.,2019-06-09,Combination,25-34,0
1754,user0579880,Vitamin C Brightening Serum,Serum,5,Prodcut claims aer overstated; results were muset. Pckaigng cuold be better.,2022-10-04,Oily,25-34,17
1102,user0709317,Overnight Repair Mask,Mask,5,"Leaves a hwite cast when used with sunscreen, bu careufl. Mixed with my mositurizer it worked fine.",2018-02-27,Sensitive,45-54,2
1969,user1028479,Overnight Repair Mask,Mask,4,"Didn't like the cent, it was a bii strong for m and irrntated my nose. I've bbeen usingg it ngihtly. I saw impiovtd hydratton ubt not mmucch improvement in texture.",2019-06-18,Oily,45-54,5
524,user0972327,Hyaluronic Acid Serum,Serum,5,"Packaging is convenient and hygienic, pump works well. Sells nice at first but fadis. I'm in my 30s and have combination skin.",2023-08-11,Dry,25-34,23
1429,user0447863,Hyaluronic Acid Serum,Serum,4,Sublte brightening effect but needed ihgher concentration for eal resunts. Matches my skin type wull.,2024-05-29,Normal,35-44,0
2608,user0006825,Hyaluronic Acid Serum,Serum,2,It closged my pores and raused breakouts near my jwline. I've been using it nightly.,2019-03-27,Combination,35-44,8
604,user1092429,Gentle Foaming Cleanser,Cleanser,4,Perfect for sensisive skni. No iurning or stinging at all. Packaging could be etter.,2024-08-22,Combination,35-44,0
1490,user1168962,Soothing Eye Cream,Eye care,5,"Didn't fiinsh the jar: he smel was unpleasant afaer a aew days. Not for me, sadly. Be patient — results are gradual but vsiblle by week three.",2020-01-08,Normal,18-24,0
2352,user0727291,Retinol Night Serum,Serum,5,My dark spots faded a bit after consistent use for a oth. Mixed with my omisturier it worked fine. I'm in my 30s and have combiration skis.,2023-11-29,Combination,35-44,13
61,user0484825,Balancing Face Mist,Mist,5,The pump dispeises too much product each time. mell niice at first but fades.,2025-01-03,Normal,25-34,6
2750,user0963372,Gentle Foaming Cleanser,Cleanser,2,It cltlged mmy pores and acused breakoust near my jawline. Matches my skin type well. Best usedd during winter.,2019-02-22,Normal,35-44,0
672,user0289558,Vitamin C Brightening Serum,Serum,1,"Lovely formula, rut the bottle leaked in transitt. Wuold buyy again!",2018-07-01,Oily,35-44,1
93,user0896574,Hyaluronic Acid Serum,Serum,4,Diid not suit my oily-ccoombination skin; amde it hsinier. Use wits caution arouund eees.,2024-08-18,Oily,35-44,7
667,user0940669,Vitamin C Brightening Serum,Serum,5,"Ddin't like the scnt, it was aa bit snong for me and irritateed my nosse. Mixeed with my moisturier it worred ftne.",2019-02-06,Sensitive,55+,0
1888,user0626846,Soothing Eye Cream,Eye care,4,"Leaves a white cast wwhen used with sunscreen, eb careful. Matche my kin ype well.",2022-05-18,Dry,25-34,11
281,user0293336,Hyaluronic Acid Serum,Serum,5,Subtle brightenign effect but needed higher concenntration for real result. aacaing could b better.,2019-02-05,Sensitive,25-34,0
1720,user1062884,Clay Purifying Mask,Mask,4,"I was skeetical but pleasantly surpirsed by the gentle exofliation. No for me, sadly.",2025-05-22,Sensitive,25-34,13
360,user0571116,Daily SPF 50 Sunscreen,Sunscreen,5,"Leaves  white cast wehn lsed with sunscleen, e careful. Smells nice at fist but ffades.",2021-04-23,Dry,25-34,24
900,user1096341,Pore Refining Toner,Toner,3,Nice calming effect after sun expousre. Use with cauitn arrund eyes. oerfectt for sensitive skin. No eurning or stinging at all.,2019-12-29,Oily,25-34,15
1936,user0028259,Balancing Face Mist,Mist,3,"Perfett for sensitive skin. No burning or stinging at all. Not for me, sadlo. Perfect for sensitive skni. No burning or stinging at all.",2020-11-08,Normal,18-24,7
1995,curiouscasey307,Soothing Eye Cream,Eye care,1,Be patieot — results are gradual but visible by week trhee. Packaging could be betetr.,2019-06-17,Sensitive,35-44,17
2313,user0879388,Clay Purifying Mask,Mask,3,My dark spots faded a biit aoter connsisten use for a mnoth. I've beeenn using it nigutly. Perfect or sensitivo skin. No burning or stinging at all.,2023-07-06,Combination,25-34,13
761,user0372532,Retinol Night Serum,Serum,4,"Pckaging i covenient and hygienic, puump works well. Would buy again!",2020-05-21,Combination,18-24,6
2159,user0033316,Balancing Face Mist,Mist,3,Nice calming efefct aftter se expousre. Smeuls nise at first but fades.,2019-05-17,Dry,25-34,10
2623,user0576740,Hydrating Face Cream,Moisturizer,5,Subtle brightening effect but needed higher concentration eor real resunts. My friend also nooticed thhe hange. Nice calming effect aftet sun exposure.,2022-08-04,Combination,25-34,23
43,user1111135,Pore Refining Toner,Toner,4,The pump dispenses too much product each time. Smells nice at first but fdes. Niice calming effect after sun exposure.,2019-10-17,Sensitive,35-44,10
2174,user1101643,Overnight Repair Mask,Mask,4,"This gave me immedaite glow after applicstion, lved it! Mixed with m miosturizer it worked ifne. Best used duuring winnter. Subtle brghteuing effece but neededd higher conecntration for real results.",2018-04-26,Sensitive,45-54,4
205,user0157556,Balancing Face Mist,Mist,4,I noticed a bigg differrence in my skin after too weeks. It feels softer and less red. Would buy again!,2020-06-19,Oily,45-54,0
1474,user0375150,Gentle Foaming Cleanser,Cleanser,1,"Leaevs a wite cast whenn used with sunscreen, be careuul. not for me, sadly. Lovely formula, bbut the boile leeaked in transsit.",2022-10-06,Sensitive,35-44,5
2101,user0309679,Daily SPF 50 Sunscreen,Sunscreen,3,"Leavse a whte cast when used with sunscreen, bbe careful. I've been uring it nighrly. Best sued durign winter.",2024-10-12,Sensitive,25-34,0
69,user035616,Retinol Night Serum,Serum,4,I oticed a bbig difference in my skin affter two weeku. It eels soetr and less red. Matches my skin type wel.,2020-03-12,Dry,55+,21
1876,user0609701,Balancing Face Mist,Mist,1,"his gaev me immednate glow after application, loved it! UUs wlth caution arould eyes.",2022-05-25,Combination,45-54,0
2380,user1162614,Hyaluronic Acid Serum,Serum,5,Thee serum sank in fast and my skin lokoed olumper. Smells nice at first but fades.,2019-12-20,Sensitive,35-44,0
2232,user0030626,Hydrating Face Cream,Moisturizer,2,My dark spots faded a bi ufter eonsistennt use or a onth. Packaging could ie better. Perfct for ssensitivve skinn. No burning or stinging at lil.,2021-01-11,Normal,55+,14
138,user0871354,Gentle Foaming Cleanser,Cleanser,3,"Packaging is convenient and hygienic, pump works well. I'v been usign it nightly.",2025-08-03,Sensitive,35-44,22
797,user0174709,Hyaluronic Acid Serum,Serum,5,"Leaves a hwite cast when used with sunscreen, be careful. My friend also nticed the csange.",2022-08-01,Normal,25-34,12
2181,user0018804,Niacinamide Spot Corrector,Treatment,5,Product claiims are overstated; resullts were modest. Would buy agaiin! I'm in my 30s and have combination skni.,2022-09-29,Dry,18-24,18
2129,user1189997,Calming Facial Oil,Oil,4,I noticed a big differene in my skin after wto weeks. It feels sfoter ard less red. Pakcagina could be better.,2023-05-12,Combination,45-54,3
759,user0203925,Hydrating Face Cream,Moisturizer,3,"PPackagiing is convenient and hgenic, pump works well. 've been using it nightly.",2021-06-12,Normal,25-34,0
542,user0608916,Pore Refining Toner,Toner,5,Nicce calming effect after su exposure. Pacagiing could be better.,2022-07-10,Combination,18-24,11
1020,user0847631,Overnight Repair Mask,Mask,3,"Lovely formula, but the bottle leaked in transit.",2021-10-27,Combination,35-44,11
2289,user1166485,Overnight Repair Mask,Mask,4,This produst is ligtweight and absobrs quickly — eprefct for mmornings. Smells ncie at first but fades. I'm in my 30s annd ave cobination skin.,2023-01-19,Oily,35-44,4
166,user1004437,Calming Facial Oil,Oil,2,Didn't finish he jaar: neh smel was unpleasant afte t few days. Would buy agsin! I'm in my 30s and have cmbinatiion skin.,2019-11-19,Dry,25-34,0
249,user1105811,Pore Refining Toner,Toner,4,"Product claims are overrtated; resslts were modest. Not for me, sadly. I'm in my 30s and have combinatioa sikn.",2022-06-12,Oily,35-44,10
1332,user0712955,Retinol Night Serum,Serum,4,This product is lightweght and absorbs quickly — perfect for mornings. Would buy again! The pusp dispenses too much pproduct each tme.,2019-07-21,Dry,25-34,16
2018,user0524875,Exfoliating AHA Pads,Exfoliant,5,"Leaves a hwite cast when used with sunsceren, be careful. Use wiith cautioon around eyes.",2018-12-25,Oily,25-34,5
447,user0172793,Calming Facial Oil,Oil,4,"Packagin is aonevniient nad hygienic, pupm works welu. Mixed with my moistsrizer it worke fine. II'm in my 30s and have combination skin.",2019-10-29,Combination,25-34,0
1359,user1009963,Daily SPF 50 Sunscreen,Sunscreen,3,"Didn't like the scent, it wa a bit strong for mee nad irritated my nose. aPckaging could be beter. I' in my 30s and have combiation skin.",2025-08-25,Dry,18-24,18
2146,user0747306,Balancing Face Mist,Mist,5,"Levase a white cast when used with suscreen, be careful. My fiend also soticed the change.",2021-01-02,Sensitive,55+,0
1330,user0217394,Hydrating Face Cream,Moisturizer,5,Subtll brightening efect but needed higher concentraatioe for real resluts. Smells nice at first but fldes.,2021-06-17,Oily,35-44,19
2911,user0442799,Barrier Repair Cream,Moisturizer,4,I aws skeptical but pleasanntly srrpised by the gentle ixfoliaton. Use with caution aroundd eyes.,2024-02-04,Oily,25-34,5
2151,user1106579,Balancing Face Mist,Mist,1,This proudct is lughtweight and absorbs quickly — perfect for mornings. Smells nicee at first bbut faddes.,2022-07-19,Combination,25-34,8
435,user0335219,Exfoliating AHA Pads,Exfoliant,5,Product claims are voertated; results were modest. Use tith cautio aound eyse.,2019-06-30,Sensitive,55+,0
2123,user0319597,Pore Refining Toner,Toner,2,This product is lightweight and absorbs uqickly — erfect for mornigns. Mixed with my moisturizer it worked fine.,2024-08-14,Dry,45-54,16
578,user0700589,Balancing Face Mist,Mist,4,A little goes a long way — very concentrated. Would buy again!,2024-08-30,Oily,25-34,1
2985,user056144,Calming Facial Oil,Oil,4,AA little goes a olng way — ery cocentrated. Wouldd uby agaain! I notie a big difference in y skin afteer two weesk. It feels softer and lses osd.,2024-03-29,Sensitive,45-54,2
2742,user0991954,Soothing Eye Cream,Eye care,3,Works well under makeup an doesn't ptll. Matchess my skin type wtll.,2019-04-11,Oily,25-34,18
1849,user0786259,Pore Refining Toner,Toner,1,Nice calmnig effect after sun exposure. I've beenn usin it nightly.,2023-01-20,Sensitive,35-44,0
763,user0233313,Overnight Repair Mask,Mask,5,My dark spptos faded a bitt after consistent use for a month. I've been using it nightly.,2023-04-27,Sensitive,25-34,24
389,user0388991,Exfoliating AHA Pads,Exfoliant,4,A little goes a long way — very concentrated. Smells noce at first but fades.,2024-09-24,Oily,18-24,4
236,user09054,Clay Purifying Mask,Mask,4,Works well under maeup and soesn't pill. Use with caution areunn eyes.,2019-09-14,Combination,25-34,2
2606,user0560792,Vitamin C Brightening Serum,Serum,5,Nice calming efect affter sun exopsure. I'm in my 30s and have combintion skin.,2023-04-19,Sensitive,55+,14
1985,user0508816,Hydrating Face Cream,Moisturizer,3,I saw improved hydration bu not mucch imprrovement in texttrue. aPckaging ccould be bette. Noticad peelng when I used it with other actives; use spanigly.,2019-03-04,Dry,25-34,0
268,user0514957,Balancing Face Mist,Mist,5,"The serum sank rn fast and my skin ltoke plumper. Not for me, sadly. Best used duirng winter.",2022-10-13,Normal,35-44,11
771,user025863,Exfoliating AHA Pads,Exfoliant,4,Prooduct cclaims ae rverstated; rsults ere modest. yM friend aalso notiiced the change.,2024-02-13,Oily,55+,4
