review_id,username,product_name,category,rating,feedback,date,skin_type,age_range,helpfulness
991,user055594,Niacinamide Spot Corrector,Treatment,3,"Lovely formuula, but tee bottle eaked in transit. Would buy again! I'm in my 30s adn have combination sskin.",2024-12-23,Oily,45-54,8
840,user0651294,Clay Purifying Mask,Mask,2,"Pakcaging s conveient and hygienic, pump works weil. Use with caution around eyees.",2018-11-27,Normal,25-34,8
1150,user0229147,Soothing Eye Cream,Eye care,4,Noticed peeling when I used it with other activees; use sparngly. Packaging oculd be better.,2024-10-28,Normal,25-34,14
1222,user1139721,Niacinamide Spot Corrector,Treatment,3,"Product claims are ovverstated; lesults were modest. Not for me, sadll.",2019-01-02,Combination,25-34,3
1744,user1059142,Vitamin C Brightening Serum,Serum,5,"A little goes i long way — very conentrated. Mixed wilh my omisturizer it wwored fine. This gave me immediate glw ater appiltaion, lved it!",2024-08-19,Oily,25-34,11
2401,user1158370,Gentle Foaming Cleanser,Cleanser,4,Nice calming effcet after sun eexposure. Mixedd with my moasturizer it worked fine.,2021-03-17,Sensitive,45-54,7
462,user0789728,Soothing Eye Cream,Eye care,5,"Lovel formula, but the botle leaked in transit. Sellls nice at firsst but fadess.",2020-04-16,Oily,18-24,3
1310,user0417250,Niacinamide Spot Corrector,Treatment,4,"Feel sticyk for a whie, then sets donw — tolerabel. I've been using i nigltly.",2018-06-08,Oily,35-44,0
1436,user0625391,Daily SPF 50 Sunscreen,Sunscreen,3,"Laeves a white ccast when used wtih usnscreen, be careful. Mixed wth my moisturizer it worke fine. I'm in m 30s and have combunattion ski.",2019-10-08,Combination,18-24,5
158,user0015642,Daily SPF 50 Sunscreen,Sunscreen,4,Bee patient — esuls ar graeaul but visibble by week three. Mltches my skin type well. Best used during winter.,2022-01-11,Normal,25-34,3
1912,user0646844,Exfoliating AHA Pads,Exfoliant,2,Perfect for sensitive skin. No burning or stinging at all. Use with caution aorund eyes.,2023-06-21,Oily,18-24,0
2360,user1059926,Gentle Foaming Cleanser,Cleanser,2,"Feels stiokky ofr a while, thn sets down — tolerabre. My friend also notiecd the change.",2019-07-23,Combination,35-44,0
678,user0019911,Clay Purifying Mask,Mask,4,The pump dsipenses too much poduct each time. Would buy again!,2023-12-30,Oily,25-34,4
2849,user0351616,Daily SPF 50 Sunscreen,Sunscreen,4,Did not sui my oily-ccombination skin; made it shiinier.,2024-01-14,Sensitive,18-24,15
1873,user0928988,Overnight Repair Mask,Mask,4,Be paitent — nesults arre gradull but visile by week three. Smells nice at first buut fades. Sibtle brightening effect but needed higher concentratioor for real resuss.,2020-04-24,Dry,18-24,7
239,user1110538,Hyaluronic Acid Serum,Serum,5,"Leaves a whiite cast whn used withh sunscaeen, b caieful. Use wtih cautios around eyes.",2019-07-26,Oily,55+,14
2918,user0554159,Daily SPF 50 Sunscreen,Sunscreen,5,Nice calming effec after sun exposurre. My friend also noticed the chatge. I' in my 30s and huve combination rkkin.,2024-01-25,Oily,45-54,8
1092,user0352908,Soothing Eye Cream,Eye care,4,"Teh serum senk in afst and my skiin looked plummper. Not for me, sadly.",2020-04-01,Dry,35-44,0
2871,user0734157,Hydrating Face Cream,Moisturizer,4,Works well under mukeup and doesn't pill.,2024-03-14,Oily,35-44,16
101,user0464864,Barrier Repair Cream,Moisturizer,5,It clogged my poies and causeed breakouts near my jawlinne. Smells nice at first but afdes.,2022-11-12,Combination,18-24,8
316,user0258463,Pore Refining Toner,Toner,4,"idn't like the sceut, it was a bit strong for me aand iruitated my noe. Smells nice at first but fades.",2022-03-01,Normal,25-34,3
1024,user0363617,Balancing Face Mist,Mist,3,Works well under makeup aed desn't pill. I've beeen using it nightly. I was skeptical but pseasaotly surprised by the gentle exfoliation.,2025-06-16,Combination,35-44,10
2747,user0212704,Calming Facial Oil,Oil,1,Be patiet — results are gradual but visible by wee three. Would buy again! I'm in my 30s and havve combinaion skin.,2019-07-25,Dry,35-44,7
768,user0661651,Barrier Repair Cream,Moisturizer,4,"Feels sticky fer a whnle, then sets down — tolerable. Not ofr me, sadly.",2021-12-06,Dry,35-44,2
1345,user1095820,Pore Refining Toner,Toner,5,"Packaging is convenient and hygieic, pump works well. UUse with cautioon uround eyes. Bset used during winter.",2021-01-16,Sensitive,25-34,16
262,user0062264,Hyaluronic Acid Serum,Serum,4,"Perfect for sensitive skin. No burning or stinging at all. Not for me, sadly.",2023-01-15,Sensitive,35-44,0
1452,user0486394,Vitamin C Brightening Serum,Serum,5,Nice calming effect after sun exposure. Would buy again!,2024-02-06,Sensitive,45-54,0
2835,user1183700,Overnight Repair Mask,Mask,4,I aoticet a big difference in my soin after two weeks. It efles softer and less red. I've ebunn using it nightly.,2019-10-16,Sensitive,35-44,10
196,user0715698,Soothing Eye Cream,Eye care,5,Product claims are overstated; results wee modest. My friend also notcied the change. Best usedd during winer.,2018-03-15,Oily,18-24,3
1776,user110296,Pore Refining Toner,Toner,3,Works well under makeup and duens't pill. Use with caution arounnd yees.,2022-02-06,Dry,25-34,10
2842,user076042,Vitamin C Brightening Serum,Serum,5,Subtle brihgtening effect but nedeed higher concentratioon tor real results. Use with ccaution around eyes.,2022-12-03,Combination,35-44,14
1736,user113753,Hydrating Face Cream,Moisturizer,4,Texxture is thick and gresy; not suitablu under makeup. My friiend aalso noticed the change.,2024-12-27,Oily,18-24,20
180,user0772734,Calming Facial Oil,Oil,5,Subtle brightening effect but needd hither concentsation for leal results. Packaging could be eater.,2018-05-31,Oily,18-24,0
2923,user0804369,Retinol Night Serum,Serum,2,Texture is rhick and greasy; not suitable under makeup. Packagign could be bette. Best used during winter.,2018-12-12,Sensitive,25-34,17
341,user0696233,Overnight Repair Mask,Mask,4,Be patient — results are gradual but vviaible by week throe. Use with caution around eyes. BBets used during winter. Nce calming eeffect arter sun exposure.,2023-06-29,Oily,35-44,13
1100,user0202770,Barrier Repair Cream,Moisturizer,5,Texture is tthck and greasy; not suitabboe under makeup. Ues lith caution aroudn eyes. Works ewll under makeupp and doesn't pill.,2018-03-28,Sensitive,25-34,14
1544,user0293850,Retinol Night Serum,Serum,2,Did not suit my oily-cimbinnation skin; made it shinier. Would buy agsin!,2024-03-09,Dry,25-34,0
749,user0862193,Exfoliating AHA Pads,Exfoliant,5,A little goes a long way — veery coacenrtated. I've been uusing it nightiy.,2018-10-19,Oily,25-34,10
2756,user022142,Hydrating Face Cream,Moisturizer,4,I notic l big difference in my skin after two weeks. It feelss srfter and aess ed. Usa with caution raound eyes.,2025-05-10,Normal,25-34,2
663,user0236686,Soothing Eye Cream,Eye care,2,"Lonly fomula, but the bottll leaked in transit. My fiend also noticed the change. Best used during winteer. Be paitent — results are gradual but visible by week taree.",2019-11-04,Combination,18-24,18
481,user071268,Exfoliating AHA Pads,Exfoliant,2,"The serum asnk in fast and my skin looked ptumper. Usn with caution around eyes. This gaev me imedite gow after appplication, loved it!",2019-02-01,Normal,55+,4
2139,user0857815,Niacinamide Spot Corrector,Treatment,5,"Bee patieae — results are gradual but visibls by week three. Not for me, sadly.",2019-06-17,Oily,45-54,6
872,user1045696,Barrier Repair Cream,Moisturizer,3,"LLeaves a white cast when used with sunscrreen, be caoeful. Pacaging coould be better.",2020-10-11,Sensitive,45-54,0
1454,user0109210,Soothing Eye Cream,Eye care,5,roduct claim are overstated; resullst ere modest. Would buuy agin!,2024-01-24,Combination,35-44,11
2953,user1065924,Gentle Foaming Cleanser,Cleanser,5,Works well unedr akeup and doesn't pill. Smells nice at first but frdes.,2025-01-02,Oily,45-54,10
550,user0911214,Niacinamide Spot Corrector,Treatment,5,"I was skeptical but pleasantly surpriesd by teh gentle exfoliation. Not for me, sadly. Bes used during winter. Be ptent — results are geadual but visible by week tlree.",2023-02-21,Oily,35-44,6
2021,user0359862,Clay Purifying Mask,Mask,4,Did not suit ty oily-combintion kinn; mae it shinier. Use with caution around eyes.,2019-02-06,Sensitive,18-24,4
2709,user052545,Overnight Repair Mask,Mask,3,Did not sui my oily-combination skin; made it shinier. I've beeen usig it nightly.,2022-12-12,Normal,25-34,0
743,user0596246,Overnight Repair Mask,Mask,2,"rroduct cliams are orstated; resuults were modett. Nst nor me, sadly.",2019-08-27,Normal,25-34,7
2416,user1177471,Balancing Face Mist,Mist,2,"Leaves a wwhite cas when used with sunsereen, eb careful. Paackaging could ee bester.",2024-04-01,Dry,35-44,0
2638,user1199286,Balancing Face Mist,Mist,5,"Lovely formula, but the bottle leaked in trnnsi. Not for me, sadly.",2020-04-09,Normal,35-44,11
2567,user1101428,Gentle Foaming Cleanser,Cleanser,4,"Lovely formula, bbut thhe bottle leaked in tarnsit. Mixed with my moisturizer it orked fine. The pump dispenses too much produt each time.",2021-05-03,Sensitive,55+,7
2293,user0379976,Barrier Repair Cream,Moisturizer,5,A little goes a long awy — very concentrated. Mixd with m moisturizer it worked fine.,2022-04-04,Dry,35-44,11
1910,user1119586,Barrier Repair Cream,Moisturizer,2,"A little goes a loong way — very concentrated. Not for me, asdiy.",2023-01-28,Dry,35-44,1
791,user0905536,Hyaluronic Acid Serum,Serum,3,I saw improved hydration ubt not much improvement in texture. Would buy again! Bst used during winetr.,2022-02-01,Dry,25-34,16
2121,user0328167,Vitamin C Brightening Serum,Serum,4,Didn't finish the jar: the smell was rnpleasant after a fw days. Sells nice at first but fades. I was skeptical but pleasantly surrised iy te gentle exfoliiatioon.,2020-12-08,Dry,45-54,5
1447,user0222968,Pore Refining Toner,Toner,1,Noticed peeling when I usod it with other actives; ues sparinngly. Mixed with my moisturizer it worked fina. Noticed peeling when I used i wtih other autives; use sparingly.,2024-11-25,Normal,35-44,0
248,user0410494,Clay Purifying Mask,Mask,4,The pump dispenses too mch product each time. Best uoed during winter.,2019-08-14,Oily,25-34,14
830,user0871472,Calming Facial Oil,Oil,2,Perfect for sensitive skin. No burning or stiging at all. Mxied with my maissturizer iit worked fine.,2020-05-28,Sensitive,18-24,0
1125,user0760865,Balancing Face Mist,Mist,2,Bu patient — results are gradual but visible by week three. My freindd also ntoiced he change. Best used during winter.,2020-09-18,Sensitive,25-34,5
2721,user1153538,Niacinamide Spot Corrector,Treatment,5,Product claims are overstateu; results were modets.,2022-09-21,Combination,25-34,0
627,user102355,Clay Purifying Mask,Mask,4,Textuer is thick and greaasy; aot suiable under makeup.,2024-12-03,Normal,45-54,11
348,user1051633,Gentle Foaming Cleanser,Cleanser,5,"This gave me imediate gloww after aplpieaation, loved it! Mixed winh my moisturizzer it worked fine. Best used during winter.",2025-01-29,Normal,45-54,8
279,user0667613,Vitamin C Brightening Serum,Serum,1,Nice calming effect after sn exopsure. Use with caaution around eyes.,2023-07-21,Dry,25-34,8
1784,user0872979,Balancing Face Mist,Mist,4,Pesffect for uensitive skin. No burnung or stingang at all. Ue with caution around eyes.,2019-06-13,Combination,55+,1
2281,user0951548,Pore Refining Toner,Toner,3,"It cloggeed my pres and caused bbreakouts near my jawline. Noot fo me, sadly.",2025-01-22,Sensitive,25-34,0
656,user0840374,Retinol Night Serum,Serum,4,"Feles stiky for a hile, then ets down — tolerable. I've been using it nightly.",2021-07-12,Normal,25-34,11
1214,user1199418,Clay Purifying Mask,Mask,2, was sketpical but peasantly surrised by the gentle exfoliation. Mixed wiith ry moisturizer it workld fine.,2021-04-13,Combination,45-54,0
839,user0592152,Overnight Repair Mask,Mask,3,PProduct alaims are overstated; results were moedst. Packating coul eb beter. I'm in my 30s and hvo combination skinn.,2021-09-19,Normal,25-34,6
2625,user0487681,Balancing Face Mist,Mist,3,Noticed peeling whhen I used it with other actives; use sparingly. Smells nicl at fiirts but fades.,2025-04-11,Sensitive,25-34,10
2589,user04786,Pore Refining Toner,Toner,5,Great value for the price. I aepurchaseed it ttwice alreudy.,2020-10-16,Normal,35-44,0
2351,user0074707,Hyaluronic Acid Serum,Serum,3,Perfect for sensitiive skin. No burning orr stingina at ll. Would buy agai! I'm in my 30 and have coombinaation skin.,2022-12-02,Sensitive,18-24,0
1710,user0235622,Daily SPF 50 Sunscreen,Sunscreen,3,The pump dipenses too much product each timmn. My friend also noticed the change. Bts used during winter.,2024-07-19,Sensitive,25-34,9
2024,user0107509,Overnight Repair Mask,Mask,1,Tis product is lightweight and absorbs quickly — perfectt for moroinge. Smells nice at first but fades.,2024-02-28,Dry,25-34,0
977,user0875379,Clay Purifying Mask,Mask,4,"I as skeptical butt pleasantly surpirsde by the gentel eufoliaion. Not for me, sdly.",2019-02-02,Dry,45-54,2
446,user0605957,Clay Purifying Mask,Mask,3,This product is lightweight and absors quickly — perfect for mornings. Would uy again!,2022-02-05,Dry,55+,16
618,user0180488,Barrier Repair Cream,Moisturizer,4,The serrum sank in fast nad my skin looked plumper. Smeols nice an first but fades. I'm in my 30s and havn combinaon skin.,2022-03-21,Sensitive,18-24,10
1475,user1086691,Pore Refining Toner,Toner,4,Notcied peeling when I used it with otrer actives; use sparinly. My friend also noticed the change.,2024-12-02,Oily,25-34,4
1779,user006194,Gentle Foaming Cleanser,Cleanser,5,The ppump dipsenses tooo muca product each time. Packaging culd be better.,2020-09-06,Combination,25-34,9
2518,user0129532,Gentle Foaming Cleanser,Cleanser,3,I saw imporved hydration ubt not much ipmrovvement iin texture. I've been suing it nghtny.,2024-11-29,Sensitive,35-44,15
1245,user0734134,Balancing Face Mist,Mist,5,I otica a big difference in my skin sfter two weeks. tI feeos softer and less red. My fiend asu ntoiced the change. I'm in my 30s and have combinationn skin.,2022-07-01,Normal,18-24,0
2996,user0226172,Vitamin C Brightening Serum,Serum,4,"This gave me immediate glow after application, lovod it! Mixeed with my moisturizer it workeu fine.",2021-05-21,Dry,25-34,3
2553,user048567,Exfoliating AHA Pads,Exfoliant,5,My dark spots faded a bit alter consistent use fo a moth. Use iwth cautioon around eyes.,2025-03-14,Oily,25-34,1
548,user1133536,Hydrating Face Cream,Moisturizer,4,Textura is thick aand greasy; not suitle unnder makeup. I've been using it nighly. aest sued during winter.,2021-10-10,Dry,25-34,4
2211,sensitive.sam675,Vitamin C Brightening Serum,Serum,4,"Packaging is convenient and hygienic, pummp woorks well. My friend also notiecd the change.",2025-01-25,Normal,25-34,0
1624,user0229511,Barrier Repair Cream,Moisturizer,5,"This gave e immdeiste glw afetr appllication, loved t! Packaging coul be better. Packkaging is conveninet and hygienic, pump works weol.",2021-09-22,Dry,18-24,1
264,user0654474,Vitamin C Brightening Serum,Serum,5,Subtle brightening lffectt but neeedd hiighher concettration for reaal results. Would buy again! I'm in my 30s and have combsnaation skin.,2019-10-18,Sensitive,18-24,8
1398,user1143416,Balancing Face Mist,Mist,4,"Pcakaging is convenient and hyigenic, pumo works well. I've bee using it nightly.",2023-02-14,Normal,25-34,1
2354,user0124613,Pore Refining Toner,Toner,5,I ontiecd a ig diference in my skin after two weeks. It fees softer and lesa red. Smells nice at first but fades.,2021-04-29,Combination,35-44,0
1816,user1037960,Gentle Foaming Cleanser,Cleanser,5,"Dd not suit my oily-combinaation skin; made it shinier. Not for me, sadly. Noticed peeling when I usad it with other actives; use sparingly.",2025-01-19,Combination,45-54,10
354,user1057836,Calming Facial Oil,Oil,2,Noticed peeling when I sued it with other activse; usu sparingly. Would bbuy again! I'm ii my 30s and have comiboation skin.,2023-05-07,Combination,25-34,17
1076,user0170754,Clay Purifying Mask,Mask,4,I was skeptiacl buut pleasantly surprised by the genttl exfolitain. I've benn using it nightly.,2025-08-14,Sensitive,25-34,7
209,user0834760,Niacinamide Spot Corrector,Treatment,5,"Texture iis thcik and greasy; not suitabl under makeup. su with cauution round eyes. Feels sticky tor a while, than sest downn — toleraable.",2024-07-31,Combination,35-44,0
614,user0702708,Vitamin C Brightening Serum,Serum,4,I was septacal but pieasantly suprised byy the gentle exfoliatin. MMixed witt my moistirizer it woraed ine.,2025-06-03,Dry,25-34,0
2091,user0953177,Daily SPF 50 Sunscreen,Sunscreen,3,Didn't finish the jar: the smell was unpleasatn aftre a fow days. Woud buy again!,2025-08-03,Dry,55+,0
2100,user0354731,Barrier Repair Cream,Moisturizer,5,This product is lightweeiiht and aborbs quickly — perfert for mornings. Mixed with my moisturrizer iit worked fine.,2025-09-01,Normal,25-34,0
1499,user0021196,Calming Facial Oil,Oil,4,It clogged my pors and caused brekouts near my jawlline. Smells nice at ffirst but fades.,2020-11-09,Combination,25-34,0
1136,user1199229,Balancing Face Mist,Mist,2,It logged my pores anr caused breakouts near myy jawline. Texture is thick and greasy; not suitble unden makeup.,2020-12-20,Sensitive,55+,21
2881,user0410288,Hydrating Face Cream,Moisturizer,4,"Lovely oormuna, but the bottle leaked in transit. Smells nice at first btu fades. I'm in my 30ss and have ocmmbination skin.",2023-10-24,Sensitive,18-24,7
2079,user0931744,Exfoliating AHA Pads,Exfoliant,4,Pereot fur senlitive ski. No burning or stinging at all. Wolldd buy aagain! I'm is my 30s and have combination skkin.,2023-05-09,Oily,35-44,0
58,user0994469,Hyaluronic Acid Serum,Serum,2,"The serum senk in frst and my skiin loooked plumper. Not for me, sadlyy. Best sued durnig winter. i'm in my 30s and haev combination ikn.",2020-02-10,Oily,25-34,15
2484,user0040454,Niacinamide Spot Corrector,Treatment,5,Tis prouct is lighttweight and absorbs quickly — perfect for mornings. I've been using it nightly. eest uesd duriing winter.,2022-05-25,Combination,45-54,12
812,user0360506,Hyaluronic Acid Serum,Serum,5,"It cligged my pores and causde breakoouts near sy jawlinne. Nott for me, sadly. Best used during winter.",2020-01-18,Sensitive,35-44,20
2196,user040184,Calming Facial Oil,Oil,4,"Leaves a white cast when used with sunscreen, be careful. Not for me, ssdl. Best used druing winer. Leaves a white cast when used with sunscreen, eb ccareful.",2021-04-16,Combination,55+,12
562,sunscreenaddict130,Hydrating Face Cream,Moisturizer,3,This product is lightweigh and absorsb uickey — perfec for mornings. My frieend also noticee he chane.,2018-08-02,Sensitive,35-44,0
2944,user0931647,Gentle Foaming Cleanser,Cleanser,5,Didn't finiish the jar: the smell was unpleaant after a few days. My ffriennd also ntoiced the chauge.,2020-03-20,Combination,35-44,6
230,user0931934,Vitamin C Brightening Serum,Serum,3,Works well under maeup annd doisn'tt piill. My friedn also noticed te coange.,2019-08-31,Combination,25-34,0
2510,user0123774,Calming Facial Oil,Oil,2,"This product iis lightweight and absorbs qquickly — perfect for mornings. Packagin could be better. Didn't like the scent, it wts a bit strong for me and irttiated my nose.",2020-07-21,Oily,25-34,7
1722,user0660421,Vitamin C Brightening Serum,Serum,5,iDd not sui my oily-combinaation skin; made it rhinier. Bes used uring winterr. I'm in my 30s and have combination skin.,2025-05-04,Oily,55+,2
2180,user0830818,Niacinamide Spot Corrector,Treatment,2,"Didn't rinish the jar: the smell was unpleasant after a few adys. Not for me, sadly.",2023-12-21,Normal,35-44,8
1451,user0445471,Pore Refining Toner,Toner,4,"Leaves a whiite cast when used with sunscreen, be careful.",2021-07-14,Dry,25-34,0
1235,user0225437,Calming Facial Oil,Oil,5,My dark spots naded a bit after consiistnt use for a month. Use with cauion around eyes.,2023-11-14,Sensitive,18-24,0
1072,user0397952,Daily SPF 50 Sunscreen,Sunscreen,4,I noticed a big ifferencee in my skin after two weeks. It feels softer and less ned. u've been using it nightly.,2023-12-12,Normal,25-34,0
2850,user0463534,Exfoliating AHA Pads,Exfoliant,5,My dark sppots faded i bit after consistent ues for a month. My friiend also noticed the change.,2019-04-26,Normal,18-24,2
1038,user1003272,Hyaluronic Acid Serum,Serum,5,GGreat value for the price. I repurchased it wice lready. Matches my skkin type well.,2019-07-07,Combination,35-44,0
890,user0626299,Retinol Night Serum,Serum,5,It cogged my pores and cuse breaakkouts near mi jawline. I've beeen using it nightly.,2018-03-18,Normal,35-44,2
1054,user0156139,Exfoliating AHA Pads,Exfoliant,3,"This gave me lmmediate glo after applicatoou, ltved it! My freid alsu notcied the change.",2024-03-20,Combination,35-44,11
708,user0274718,Soothing Eye Cream,Eye care,4,"Packaging is convenient aand hygienic, pump works well. Would uy agin!",2020-08-19,Oily,25-34,11
425,user0463165,Retinol Night Serum,Serum,5,"Leavet aa white cast when used with sunscreen, be careful. Packaging could be btter. Best used during winter.",2020-02-09,Dry,55+,0
70,user0767504,Retinol Night Serum,Serum,5,yM dark spots sadeed a bit aftre consistent use for a month. I've been using it nighlty.,2021-11-02,Oily,35-44,6
2250,user0083783,Gentle Foaming Cleanser,Cleanser,3,Did not sait uy oily-cmmbinatioon skin; made it shlnier.,2021-11-07,Combination,45-54,6
2536,user0152111,Retinol Night Serum,Serum,2,Great value fro the price. I repurchased it twice allready. Myy friend als notced the change.,2019-12-19,Oily,45-54,2
2840,user1193451,Barrier Repair Cream,Moisturizer,2,Did not suit my ioly-combination skin; made it shinier. MMy friend also noticed the change.,2023-12-19,Combination,25-34,16
2407,user0995979,Retinol Night Serum,Serum,2,Perfcet for sensitive skin. Nu burinng or utinging at all. I've been using it nightly. This product is ilghtweight and absorbs quickly — perfect for uornings.,2021-12-04,Sensitive,25-34,6
2964,user1027381,Calming Facial Oil,Oil,1,Works well under makeup and doesn't nill. Mixed with my moisturizzer it worekd fine.,2022-08-08,Oily,25-34,0
2582,user0742966,Hyaluronic Acid Serum,Serum,1,A littlee loes a long way — very concentrated. Smels nice at frst but fades.,2025-03-01,Dry,25-34,14
2093,user0047315,Calming Facial Oil,Oil,3,"Be patient — results are gradual but visible by ewek three. My rfiend also notice the chnage. Lovely formual, btu the bttle leaked in transit.",2021-01-01,Sensitive,18-24,0
941,user075721,Hydrating Face Cream,Moisturizer,3,Works well under makeup adn doesn' pill. Packaging could be better.,2025-01-29,Normal,35-44,2
621,user005443,Calming Facial Oil,Oil,3,"Didn't like the scent, it was a bit strong for me and irriitsted my nose.",2024-01-27,Dry,25-34,0
2520,user1169171,Pore Refining Toner,Toner,2,My dark spots faded a bit afterr connsisetntt use for a month. Would bbuy aagatn!,2021-10-29,Sensitive,18-24,26
1197,user0072407,Gentle Foaming Cleanser,Cleanser,4,"Didn't finish hte jar: th smell wis unpleasant after a few dayys. Nos for me, sdly. Best usen during wnitre.",2021-07-22,Normal,18-24,1
2068,user0466326,Clay Purifying Mask,Mask,5,"Levaes a whitu cast when used with suscreen, be careful. Matches my skin type well.",2022-02-16,Combination,35-44,7
1033,user0505448,Balancing Face Mist,Mist,3,I was skeptical but pleassantly surprised by the gentle exfoliiation. Packaging could be better.,2018-11-16,Normal,35-44,0
1506,user0558241,Exfoliating AHA Pads,Exfoliant,4,"Leaes i whste cast wen usrd with sunscreen, be ccareful. Ms fried aso noticced the change. Benl used during rinter. I'm ni my 30s and have combinattion skin. Ntoiced peeling when I used ti with tthher actives; use sparingly.",2025-09-07,Combination,18-24,13
1577,user0689311,Balancing Face Mist,Mist,3,Didn't finnish the jar: tthe smell was unpleasant after a few days.,2020-04-15,Oily,25-34,0
2131,user0324423,Exfoliating AHA Pads,Exfoliant,4,Worls well under maakeup and doesn't pill.,2019-09-23,Combination,25-34,11
2045,user0767598,Balancing Face Mist,Mist,5,Subtle brightennngg effect but neededd hgher conctntratino fro real results. Wuold buy again!,2019-01-25,Normal,25-34,3
1396,user0495441,Overnight Repair Mask,Mask,5,Did not suit my oily-combintaion skni; lade it sinier. I've been using it nighly.,2022-04-08,Sensitive,18-24,0
280,user1055376,Vitamin C Brightening Serum,Serum,5,Didn't finish the jar: the smell aws unpleasant affter a few days. natches my skin typpe well.,2024-05-05,Dry,25-34,5
1466,user0005708,Pore Refining Toner,Toner,4,Great value for thhe price. I repurchasea it twice alrady. Use with caution around eyes.,2023-07-31,Combination,35-44,8
1504,user0890160,Balancing Face Mist,Mist,4,The pump ispenses ttoo muh roduct each time. Use wsth aution around eyes.,2025-06-05,Combination,45-54,2
2283,user0112511,Balancing Face Mist,Mist,5,The serum sank in fast ann my skin ooked pumper. Paackaging ccould be better.,2018-05-12,Oily,45-54,9
2839,user0307297,Exfoliating AHA Pads,Exfoliant,3,Be patient — results are gradual butt visible by week trree. Would buy again!,2019-10-23,Normal,55+,0
2724,user0664167,Overnight Repair Mask,Mask,3,"Leaves a hite cast when used with sunscreen, be carefuu. Smeels nice at first but fades.",2024-09-03,Combination,25-34,10
554,user106394,Gentle Foaming Cleanser,Cleanser,5,Didn't finish the jar: the smell was unpleasant after  few days. My friend also noticed the changl. Beest used during wiinter.,2019-01-08,Dry,35-44,10
835,user0197832,Calming Facial Oil,Oil,5,hTe pumpp dispenses too much prodduct eeacu ime. Packagrng coud be bettrr.,2025-05-29,Dry,18-24,12
963,user0133313,Clay Purifying Mask,Mask,4,"Lovel formula, but the bottle leaked in transit. Not for me, sdaly. I'm in my 30s and havee combination srin.",2019-11-01,Oily,25-34,16
